{
  "$schema": "https://blockprotocol.org/types/modules/graph/0.3/schema/property-type",
  "kind": "propertyType",
  "$id": "https://blockprotocol.org/@alice/types/property-type/contrived-property/v/1",
  "title": "Contrived Property",
  "oneOf": [
    {
      "$ref": "https://blockprotocol.org/@blockprotocol/types/data-type/number/v/1"
    },
    {
      "type": "array",
      "items": {
        "oneOf": [
          {
            "$ref": "https://blockprotocol.org/@blockprotocol/types/data-type/number/v/1"
          }
        ]
      },
      "maxItems": 4
    }
  ]
}
